{
  "id": "agt_ops_assistant_v1",
  "workspace_id": "wsp_mindverse_cn",
  "name": "Ops Assistant",
  "role": "ops_assistant",
  "owners": [
    "usr_yingapple"
  ],
  "model_policy": {
    "provider": "openai",
    "model": "gpt-5",
    "temperature": 0.2,
    "max_tokens": 64000
  },
  "default_policy_profile": "polprof_ops_standard",
  "status": "active",
  "metadata": {
    "locale": "zh-CN"
  },
  "created_at": "2026-02-22T12:00:00Z",
  "updated_at": "2026-02-22T12:00:00Z"
}
